{
  "auxiliary_range": [
    97,
    453
  ],
  "dialect": "legacy_dimacs_wcnf",
  "encoder": "pindakaas/PySAT PBEnc BDD",
  "hard_clauses": 1519,
  "objective_transform": {
    "multiplier": 1,
    "offset": 0
  },
  "primary_end": 96,
  "schema_version": "1.0.0",
  "soft_clauses": 36,
  "soft_weight_sum": 488,
  "top": 489,
  "variable_count": 453,
  "variables": {
    "inventory:M0:P0:0:0": {
      "bits": [
        1,
        2,
        3,
        4,
        5
      ],
      "kind": "integer",
      "lower": 0,
      "meaning": [
        "inventory",
        "M0",
        "P0",
        0,
        0
      ],
      "name": "inventory:M0:P0:0:0",
      "unit": "item",
      "upper": 20
    },
    "inventory:M0:P1:0:0": {
      "bits": [
        6,
        7,
        8,
        9,
        10
      ],
      "kind": "integer",
      "lower": 0,
      "meaning": [
        "inventory",
        "M0",
        "P1",
        0,
        0
      ],
      "name": "inventory:M0:P1:0:0",
      "unit": "item",
      "upper": 20
    },
    "inventory:M1:P0:0:0": {
      "bits": [
        11,
        12,
        13,
        14,
        15
      ],
      "kind": "integer",
      "lower": 0,
      "meaning": [
        "inventory",
        "M1",
        "P0",
        0,
        0
      ],
      "name": "inventory:M1:P0:0:0",
      "unit": "item",
      "upper": 20
    },
    "inventory:M1:P1:0:0": {
      "bits": [
        16,
        17,
        18,
        19,
        20
      ],
      "kind": "integer",
      "lower": 0,
      "meaning": [
        "inventory",
        "M1",
        "P1",
        0,
        0
      ],
      "name": "inventory:M1:P1:0:0",
      "unit": "item",
      "upper": 20
    },
    "inventory:W0:P0:0:0": {
      "bits": [
        21,
        22,
        23,
        24,
        25
      ],
      "kind": "integer",
      "lower": 0,
      "meaning": [
        "inventory",
        "W0",
        "P0",
        0,
        0
      ],
      "name": "inventory:W0:P0:0:0",
      "unit": "item",
      "upper": 20
    },
    "inventory:W0:P1:0:0": {
      "bits": [
        26,
        27,
        28,
        29,
        30
      ],
      "kind": "integer",
      "lower": 0,
      "meaning": [
        "inventory",
        "W0",
        "P1",
        0,
        0
      ],
      "name": "inventory:W0:P1:0:0",
      "unit": "item",
      "upper": 20
    },
    "inventory:W1:P0:0:0": {
      "bits": [
        31,
        32,
        33,
        34,
        35
      ],
      "kind": "integer",
      "lower": 0,
      "meaning": [
        "inventory",
        "W1",
        "P0",
        0,
        0
      ],
      "name": "inventory:W1:P0:0:0",
      "unit": "item",
      "upper": 20
    },
    "inventory:W1:P1:0:0": {
      "bits": [
        36,
        37,
        38,
        39,
        40
      ],
      "kind": "integer",
      "lower": 0,
      "meaning": [
        "inventory",
        "W1",
        "P1",
        0,
        0
      ],
      "name": "inventory:W1:P1:0:0",
      "unit": "item",
      "upper": 20
    },
    "inventory:W2:P0:0:0": {
      "bits": [
        41,
        42,
        43,
        44,
        45
      ],
      "kind": "integer",
      "lower": 0,
      "meaning": [
        "inventory",
        "W2",
        "P0",
        0,
        0
      ],
      "name": "inventory:W2:P0:0:0",
      "unit": "item",
      "upper": 20
    },
    "inventory:W2:P1:0:0": {
      "bits": [
        46,
        47,
        48,
        49,
        50
      ],
      "kind": "integer",
      "lower": 0,
      "meaning": [
        "inventory",
        "W2",
        "P1",
        0,
        0
      ],
      "name": "inventory:W2:P1:0:0",
      "unit": "item",
      "upper": 20
    },
    "serve:M0:P0:0:0": {
      "bits": [
        51,
        52,
        53
      ],
      "kind": "integer",
      "lower": 0,
      "meaning": [
        "serve",
        "M0",
        "P0",
        0,
        0
      ],
      "name": "serve:M0:P0:0:0",
      "unit": "item",
      "upper": 5
    },
    "serve:M0:P1:0:0": {
      "bits": [
        54,
        55
      ],
      "kind": "integer",
      "lower": 0,
      "meaning": [
        "serve",
        "M0",
        "P1",
        0,
        0
      ],
      "name": "serve:M0:P1:0:0",
      "unit": "item",
      "upper": 3
    },
    "serve:M1:P0:0:0": {
      "bits": [
        56,
        57
      ],
      "kind": "integer",
      "lower": 0,
      "meaning": [
        "serve",
        "M1",
        "P0",
        0,
        0
      ],
      "name": "serve:M1:P0:0:0",
      "unit": "item",
      "upper": 2
    },
    "serve:M1:P1:0:0": {
      "bits": [
        58,
        59,
        60
      ],
      "kind": "integer",
      "lower": 0,
      "meaning": [
        "serve",
        "M1",
        "P1",
        0,
        0
      ],
      "name": "serve:M1:P1:0:0",
      "unit": "item",
      "upper": 5
    },
    "ship:R_W0_M0_standard:P0:0:0": {
      "bits": [
        61,
        62,
        63,
        64
      ],
      "kind": "integer",
      "lower": 0,
      "meaning": [
        "ship",
        "R_W0_M0_standard",
        "P0",
        0,
        0
      ],
      "name": "ship:R_W0_M0_standard:P0:0:0",
      "unit": "item",
      "upper": 8
    },
    "ship:R_W0_M0_standard:P1:0:0": {
      "bits": [
        65,
        66,
        67,
        68
      ],
      "kind": "integer",
      "lower": 0,
      "meaning": [
        "ship",
        "R_W0_M0_standard",
        "P1",
        0,
        0
      ],
      "name": "ship:R_W0_M0_standard:P1:0:0",
      "unit": "item",
      "upper": 8
    },
    "ship:R_W0_M1_standard:P0:0:0": {
      "bits": [
        69,
        70
      ],
      "kind": "integer",
      "lower": 0,
      "meaning": [
        "ship",
        "R_W0_M1_standard",
        "P0",
        0,
        0
      ],
      "name": "ship:R_W0_M1_standard:P0:0:0",
      "unit": "item",
      "upper": 2
    },
    "ship:R_W0_M1_standard:P1:0:0": {
      "bits": [
        71,
        72
      ],
      "kind": "integer",
      "lower": 0,
      "meaning": [
        "ship",
        "R_W0_M1_standard",
        "P1",
        0,
        0
      ],
      "name": "ship:R_W0_M1_standard:P1:0:0",
      "unit": "item",
      "upper": 2
    },
    "ship:R_W1_M0_standard:P0:0:0": {
      "bits": [
        73,
        74,
        75
      ],
      "kind": "integer",
      "lower": 0,
      "meaning": [
        "ship",
        "R_W1_M0_standard",
        "P0",
        0,
        0
      ],
      "name": "ship:R_W1_M0_standard:P0:0:0",
      "unit": "item",
      "upper": 6
    },
    "ship:R_W1_M0_standard:P1:0:0": {
      "bits": [
        76,
        77,
        78
      ],
      "kind": "integer",
      "lower": 0,
      "meaning": [
        "ship",
        "R_W1_M0_standard",
        "P1",
        0,
        0
      ],
      "name": "ship:R_W1_M0_standard:P1:0:0",
      "unit": "item",
      "upper": 6
    },
    "ship:R_W1_M1_standard:P0:0:0": {
      "bits": [
        79,
        80
      ],
      "kind": "integer",
      "lower": 0,
      "meaning": [
        "ship",
        "R_W1_M1_standard",
        "P0",
        0,
        0
      ],
      "name": "ship:R_W1_M1_standard:P0:0:0",
      "unit": "item",
      "upper": 3
    },
    "ship:R_W1_M1_standard:P1:0:0": {
      "bits": [
        81,
        82
      ],
      "kind": "integer",
      "lower": 0,
      "meaning": [
        "ship",
        "R_W1_M1_standard",
        "P1",
        0,
        0
      ],
      "name": "ship:R_W1_M1_standard:P1:0:0",
      "unit": "item",
      "upper": 3
    },
    "ship:R_W2_M0_standard:P0:0:0": {
      "bits": [
        83,
        84,
        85,
        86
      ],
      "kind": "integer",
      "lower": 0,
      "meaning": [
        "ship",
        "R_W2_M0_standard",
        "P0",
        0,
        0
      ],
      "name": "ship:R_W2_M0_standard:P0:0:0",
      "unit": "item",
      "upper": 8
    },
    "ship:R_W2_M0_standard:P1:0:0": {
      "bits": [
        87,
        88,
        89,
        90
      ],
      "kind": "integer",
      "lower": 0,
      "meaning": [
        "ship",
        "R_W2_M0_standard",
        "P1",
        0,
        0
      ],
      "name": "ship:R_W2_M0_standard:P1:0:0",
      "unit": "item",
      "upper": 8
    },
    "ship:R_W2_M1_standard:P0:0:0": {
      "bits": [
        91,
        92,
        93
      ],
      "kind": "integer",
      "lower": 0,
      "meaning": [
        "ship",
        "R_W2_M1_standard",
        "P0",
        0,
        0
      ],
      "name": "ship:R_W2_M1_standard:P0:0:0",
      "unit": "item",
      "upper": 7
    },
    "ship:R_W2_M1_standard:P1:0:0": {
      "bits": [
        94,
        95,
        96
      ],
      "kind": "integer",
      "lower": 0,
      "meaning": [
        "ship",
        "R_W2_M1_standard",
        "P1",
        0,
        0
      ],
      "name": "ship:R_W2_M1_standard:P1:0:0",
      "unit": "item",
      "upper": 7
    }
  }
}
