{
  "auxiliary_range": [
    36,
    156
  ],
  "dialect": "legacy_dimacs_wcnf",
  "encoder": "pindakaas/PySAT PBEnc BDD",
  "hard_clauses": 470,
  "objective_transform": {
    "multiplier": 1,
    "offset": 0
  },
  "primary_end": 35,
  "schema_version": "1.0.0",
  "soft_clauses": 20,
  "soft_weight_sum": 315,
  "top": 316,
  "variable_count": 156,
  "variables": {
    "inventory:M0:P0:0:0": {
      "bits": [
        1,
        2,
        3
      ],
      "kind": "integer",
      "lower": 0,
      "meaning": [
        "inventory",
        "M0",
        "P0",
        0,
        0
      ],
      "name": "inventory:M0:P0:0:0",
      "unit": "item",
      "upper": 6
    },
    "inventory:W0:P0:0:0": {
      "bits": [
        4,
        5,
        6
      ],
      "kind": "integer",
      "lower": 0,
      "meaning": [
        "inventory",
        "W0",
        "P0",
        0,
        0
      ],
      "name": "inventory:W0:P0:0:0",
      "unit": "item",
      "upper": 6
    },
    "inventory:W1:P0:0:0": {
      "bits": [
        7,
        8,
        9
      ],
      "kind": "integer",
      "lower": 0,
      "meaning": [
        "inventory",
        "W1",
        "P0",
        0,
        0
      ],
      "name": "inventory:W1:P0:0:0",
      "unit": "item",
      "upper": 6
    },
    "inventory:W2:P0:0:0": {
      "bits": [
        10,
        11,
        12
      ],
      "kind": "integer",
      "lower": 0,
      "meaning": [
        "inventory",
        "W2",
        "P0",
        0,
        0
      ],
      "name": "inventory:W2:P0:0:0",
      "unit": "item",
      "upper": 6
    },
    "serve:M0:P0:0:0": {
      "bits": [
        13,
        14,
        15
      ],
      "kind": "integer",
      "lower": 0,
      "meaning": [
        "serve",
        "M0",
        "P0",
        0,
        0
      ],
      "name": "serve:M0:P0:0:0",
      "unit": "item",
      "upper": 4
    },
    "ship:R_W0_M0_rail:P0:0:0": {
      "bits": [
        16,
        17,
        18
      ],
      "kind": "integer",
      "lower": 0,
      "meaning": [
        "ship",
        "R_W0_M0_rail",
        "P0",
        0,
        0
      ],
      "name": "ship:R_W0_M0_rail:P0:0:0",
      "unit": "item",
      "upper": 5
    },
    "ship:R_W0_M0_road:P0:0:0": {
      "bits": [
        19,
        20,
        21
      ],
      "kind": "integer",
      "lower": 0,
      "meaning": [
        "ship",
        "R_W0_M0_road",
        "P0",
        0,
        0
      ],
      "name": "ship:R_W0_M0_road:P0:0:0",
      "unit": "item",
      "upper": 6
    },
    "ship:R_W2_M0_rail:P0:0:0": {
      "bits": [
        22,
        23,
        24
      ],
      "kind": "integer",
      "lower": 0,
      "meaning": [
        "ship",
        "R_W2_M0_rail",
        "P0",
        0,
        0
      ],
      "name": "ship:R_W2_M0_rail:P0:0:0",
      "unit": "item",
      "upper": 6
    },
    "ship:R_W2_M0_road:P0:0:0": {
      "bits": [
        25,
        26,
        27
      ],
      "kind": "integer",
      "lower": 0,
      "meaning": [
        "ship",
        "R_W2_M0_road",
        "P0",
        0,
        0
      ],
      "name": "ship:R_W2_M0_road:P0:0:0",
      "unit": "item",
      "upper": 4
    },
    "trucks:R_W0_M0_rail:0": {
      "bits": [
        28,
        29
      ],
      "kind": "integer",
      "lower": 0,
      "meaning": [
        "trucks",
        "R_W0_M0_rail",
        0
      ],
      "name": "trucks:R_W0_M0_rail:0",
      "unit": "truck",
      "upper": 2
    },
    "trucks:R_W0_M0_road:0": {
      "bits": [
        30,
        31
      ],
      "kind": "integer",
      "lower": 0,
      "meaning": [
        "trucks",
        "R_W0_M0_road",
        0
      ],
      "name": "trucks:R_W0_M0_road:0",
      "unit": "truck",
      "upper": 2
    },
    "trucks:R_W2_M0_rail:0": {
      "bits": [
        32,
        33,
        34
      ],
      "kind": "integer",
      "lower": 0,
      "meaning": [
        "trucks",
        "R_W2_M0_rail",
        0
      ],
      "name": "trucks:R_W2_M0_rail:0",
      "unit": "truck",
      "upper": 4
    },
    "trucks:R_W2_M0_road:0": {
      "bits": [
        35
      ],
      "kind": "integer",
      "lower": 0,
      "meaning": [
        "trucks",
        "R_W2_M0_road",
        0
      ],
      "name": "trucks:R_W2_M0_road:0",
      "unit": "truck",
      "upper": 1
    }
  }
}
