{
  "auxiliary_range": [
    65,
    167
  ],
  "dialect": "legacy_dimacs_wcnf",
  "encoder": "pindakaas/PySAT PBEnc BDD",
  "hard_clauses": 510,
  "objective_transform": {
    "multiplier": 1,
    "offset": 0
  },
  "primary_end": 64,
  "schema_version": "1.0.0",
  "soft_clauses": 13,
  "soft_weight_sum": 260,
  "top": 261,
  "variable_count": 167,
  "variables": {
    "inventory:M0:P0:0:0": {
      "bits": [
        1,
        2,
        3,
        4,
        5,
        6
      ],
      "kind": "integer",
      "lower": 0,
      "meaning": [
        "inventory",
        "M0",
        "P0",
        0,
        0
      ],
      "name": "inventory:M0:P0:0:0",
      "unit": "item",
      "upper": 32
    },
    "inventory:M0:RAW:0:0": {
      "bits": [
        7,
        8,
        9,
        10,
        11,
        12
      ],
      "kind": "integer",
      "lower": 0,
      "meaning": [
        "inventory",
        "M0",
        "RAW",
        0,
        0
      ],
      "name": "inventory:M0:RAW:0:0",
      "unit": "item",
      "upper": 32
    },
    "inventory:W0:P0:0:0": {
      "bits": [
        13,
        14,
        15,
        16,
        17,
        18
      ],
      "kind": "integer",
      "lower": 0,
      "meaning": [
        "inventory",
        "W0",
        "P0",
        0,
        0
      ],
      "name": "inventory:W0:P0:0:0",
      "unit": "item",
      "upper": 32
    },
    "inventory:W0:RAW:0:0": {
      "bits": [
        19,
        20,
        21,
        22,
        23,
        24
      ],
      "kind": "integer",
      "lower": 0,
      "meaning": [
        "inventory",
        "W0",
        "RAW",
        0,
        0
      ],
      "name": "inventory:W0:RAW:0:0",
      "unit": "item",
      "upper": 32
    },
    "inventory:W1:P0:0:0": {
      "bits": [
        25,
        26,
        27,
        28,
        29,
        30
      ],
      "kind": "integer",
      "lower": 0,
      "meaning": [
        "inventory",
        "W1",
        "P0",
        0,
        0
      ],
      "name": "inventory:W1:P0:0:0",
      "unit": "item",
      "upper": 32
    },
    "inventory:W1:RAW:0:0": {
      "bits": [
        31,
        32,
        33,
        34,
        35,
        36
      ],
      "kind": "integer",
      "lower": 0,
      "meaning": [
        "inventory",
        "W1",
        "RAW",
        0,
        0
      ],
      "name": "inventory:W1:RAW:0:0",
      "unit": "item",
      "upper": 32
    },
    "inventory:W2:P0:0:0": {
      "bits": [
        37,
        38,
        39,
        40,
        41,
        42
      ],
      "kind": "integer",
      "lower": 0,
      "meaning": [
        "inventory",
        "W2",
        "P0",
        0,
        0
      ],
      "name": "inventory:W2:P0:0:0",
      "unit": "item",
      "upper": 32
    },
    "inventory:W2:RAW:0:0": {
      "bits": [
        43,
        44,
        45,
        46,
        47,
        48
      ],
      "kind": "integer",
      "lower": 0,
      "meaning": [
        "inventory",
        "W2",
        "RAW",
        0,
        0
      ],
      "name": "inventory:W2:RAW:0:0",
      "unit": "item",
      "upper": 32
    },
    "produce:B_W0:0": {
      "bits": [
        49
      ],
      "kind": "integer",
      "lower": 0,
      "meaning": [
        "produce",
        "B_W0",
        0
      ],
      "name": "produce:B_W0:0",
      "unit": "batch",
      "upper": 1
    },
    "produce:B_W1:0": {
      "bits": [
        50,
        51
      ],
      "kind": "integer",
      "lower": 0,
      "meaning": [
        "produce",
        "B_W1",
        0
      ],
      "name": "produce:B_W1:0",
      "unit": "batch",
      "upper": 2
    },
    "produce:B_W2:0": {
      "bits": [
        52,
        53,
        54
      ],
      "kind": "integer",
      "lower": 0,
      "meaning": [
        "produce",
        "B_W2",
        0
      ],
      "name": "produce:B_W2:0",
      "unit": "batch",
      "upper": 6
    },
    "serve:M0:P0:0:0": {
      "bits": [
        55,
        56,
        57
      ],
      "kind": "integer",
      "lower": 0,
      "meaning": [
        "serve",
        "M0",
        "P0",
        0,
        0
      ],
      "name": "serve:M0:P0:0:0",
      "unit": "item",
      "upper": 5
    },
    "ship:R_W1_M0_standard:P0:0:0": {
      "bits": [
        58,
        59,
        60
      ],
      "kind": "integer",
      "lower": 0,
      "meaning": [
        "ship",
        "R_W1_M0_standard",
        "P0",
        0,
        0
      ],
      "name": "ship:R_W1_M0_standard:P0:0:0",
      "unit": "item",
      "upper": 5
    },
    "ship:R_W2_M0_standard:P0:0:0": {
      "bits": [
        61,
        62,
        63,
        64
      ],
      "kind": "integer",
      "lower": 0,
      "meaning": [
        "ship",
        "R_W2_M0_standard",
        "P0",
        0,
        0
      ],
      "name": "ship:R_W2_M0_standard:P0:0:0",
      "unit": "item",
      "upper": 9
    }
  }
}
