{
  "auxiliary_range": [
    43,
    157
  ],
  "dialect": "legacy_dimacs_wcnf",
  "encoder": "pindakaas/PySAT PBEnc BDD",
  "hard_clauses": 489,
  "objective_transform": {
    "multiplier": 1,
    "offset": 0
  },
  "primary_end": 42,
  "schema_version": "1.0.0",
  "soft_clauses": 10,
  "soft_weight_sum": 207,
  "top": 208,
  "variable_count": 157,
  "variables": {
    "inventory:H0:P0:0:0": {
      "bits": [
        1,
        2,
        3,
        4
      ],
      "kind": "integer",
      "lower": 0,
      "meaning": [
        "inventory",
        "H0",
        "P0",
        0,
        0
      ],
      "name": "inventory:H0:P0:0:0",
      "unit": "item",
      "upper": 13
    },
    "inventory:M0:P0:0:0": {
      "bits": [
        5,
        6,
        7,
        8
      ],
      "kind": "integer",
      "lower": 0,
      "meaning": [
        "inventory",
        "M0",
        "P0",
        0,
        0
      ],
      "name": "inventory:M0:P0:0:0",
      "unit": "item",
      "upper": 13
    },
    "inventory:M1:P0:0:0": {
      "bits": [
        9,
        10,
        11,
        12
      ],
      "kind": "integer",
      "lower": 0,
      "meaning": [
        "inventory",
        "M1",
        "P0",
        0,
        0
      ],
      "name": "inventory:M1:P0:0:0",
      "unit": "item",
      "upper": 13
    },
    "inventory:W0:P0:0:0": {
      "bits": [
        13,
        14,
        15,
        16
      ],
      "kind": "integer",
      "lower": 0,
      "meaning": [
        "inventory",
        "W0",
        "P0",
        0,
        0
      ],
      "name": "inventory:W0:P0:0:0",
      "unit": "item",
      "upper": 13
    },
    "inventory:W1:P0:0:0": {
      "bits": [
        17,
        18,
        19,
        20
      ],
      "kind": "integer",
      "lower": 0,
      "meaning": [
        "inventory",
        "W1",
        "P0",
        0,
        0
      ],
      "name": "inventory:W1:P0:0:0",
      "unit": "item",
      "upper": 13
    },
    "inventory:W2:P0:0:0": {
      "bits": [
        21,
        22,
        23,
        24
      ],
      "kind": "integer",
      "lower": 0,
      "meaning": [
        "inventory",
        "W2",
        "P0",
        0,
        0
      ],
      "name": "inventory:W2:P0:0:0",
      "unit": "item",
      "upper": 13
    },
    "serve:M0:P0:0:0": {
      "bits": [
        25,
        26
      ],
      "kind": "integer",
      "lower": 0,
      "meaning": [
        "serve",
        "M0",
        "P0",
        0,
        0
      ],
      "name": "serve:M0:P0:0:0",
      "unit": "item",
      "upper": 3
    },
    "serve:M1:P0:0:0": {
      "bits": [
        27,
        28,
        29
      ],
      "kind": "integer",
      "lower": 0,
      "meaning": [
        "serve",
        "M1",
        "P0",
        0,
        0
      ],
      "name": "serve:M1:P0:0:0",
      "unit": "item",
      "upper": 5
    },
    "ship:R_H0_M0_standard:P0:0:0": {
      "bits": [
        30,
        31,
        32
      ],
      "kind": "integer",
      "lower": 0,
      "meaning": [
        "ship",
        "R_H0_M0_standard",
        "P0",
        0,
        0
      ],
      "name": "ship:R_H0_M0_standard:P0:0:0",
      "unit": "item",
      "upper": 4
    },
    "ship:R_H0_M1_standard:P0:0:0": {
      "bits": [
        33,
        34,
        35
      ],
      "kind": "integer",
      "lower": 0,
      "meaning": [
        "ship",
        "R_H0_M1_standard",
        "P0",
        0,
        0
      ],
      "name": "ship:R_H0_M1_standard:P0:0:0",
      "unit": "item",
      "upper": 7
    },
    "ship:R_W0_H0_standard:P0:0:0": {
      "bits": [
        36,
        37,
        38
      ],
      "kind": "integer",
      "lower": 0,
      "meaning": [
        "ship",
        "R_W0_H0_standard",
        "P0",
        0,
        0
      ],
      "name": "ship:R_W0_H0_standard:P0:0:0",
      "unit": "item",
      "upper": 7
    },
    "ship:R_W1_H0_standard:P0:0:0": {
      "bits": [
        39,
        40,
        41,
        42
      ],
      "kind": "integer",
      "lower": 0,
      "meaning": [
        "ship",
        "R_W1_H0_standard",
        "P0",
        0,
        0
      ],
      "name": "ship:R_W1_H0_standard:P0:0:0",
      "unit": "item",
      "upper": 10
    }
  }
}
